{
  "format": "facetwire.agent-scene-package",
  "version": "0.1",
  "id": "document:rich-media-showcase:level-2",
  "title": "FacetWire Rich Media Showcase / Level 2",
  "canvas": {
    "id": "canvas:rich-media-level-2",
    "size": {"width": 330, "height": 410},
    "pages": [{"id": "page:rich-media-level-2", "size": {"width": 330, "height": 410}, "layers": [
      {"id": "layer:image:level-2", "z": 0, "zones": [{"id": "zone:image:level-2", "bounds": {"x": 10, "y": 10, "width": 300, "height": 180}, "semantics": {"role": "image", "label": "Level 2 image"}, "content": {"type": "image", "resource": "image:level-2", "alt": "Level 2 image", "opacity": 0.72, "placement": {"fit": "cover", "alignment": {"x": 0.5, "y": 0.5}, "clip": true}}}]},
      {"id": "layer:text:level-2", "z": 10, "zones": [{"id": "zone:text:level-2", "bounds": {"x": 25, "y": 28, "width": 260, "height": 92}, "semantics": {"role": "text", "label": "Level 2 overlay text"}, "content": {"type": "text", "format": "plain", "text": "Level 2 / 第二层\n图片、图表与子文档保持原始坐标。", "language": "zh-CN", "selectable": true, "opacity": 0.93, "style": {"fontSize": 16, "fontWeight": 600, "lineHeightMultiplier": 1.2, "color": {"red": 0.03, "green": 0.08, "blue": 0.12, "alpha": 1}, "backgroundColor": {"red": 1, "green": 1, "blue": 1, "alpha": 0.76}}, "layout": {"overflow": "clip", "padding": {"top": 8, "right": 8, "bottom": 8, "left": 8}}}}]},
      {"id": "layer:chart:level-2", "z": 14, "zones": [{"id": "zone:chart:level-2", "bounds": {"x": 22, "y": 170, "width": 285, "height": 170}, "semantics": {"role": "img", "label": "Level 2 latency chart"}, "content": {"type": "chart", "chartType": "bar", "title": "Latency / 延迟", "opacity": 0.88, "data": [{"label": "Local", "value": 34, "color": "#0F766E"}, {"label": "Remote", "value": 78, "color": "#D97706"}, {"label": "Cache", "value": 18, "color": "#2563EB"}]}}]},
      {"id": "layer:document:level-3", "z": 20, "zones": [{"id": "zone:document:level-3", "bounds": {"x": 85, "y": 250, "width": 220, "height": 145}, "semantics": {"role": "document", "label": "Nested level 3 at native size"}, "content": {"type": "document", "source": "documents/level-3.agscene/level-3.agscene.dis.json", "placement": {"fit": "none", "alignment": {"x": 0, "y": 0}, "clip": true}}}]}
    ]}]
  },
  "resources": [{"id": "image:level-2", "source": "resources/level-2.png", "mediaType": "image/png"}]
}